descriptor,dimensions,metaphor_types,flag
there's an alien trying to get out of me.   ,"['sensory', 'metaphorical']",['attacking_agents'],False
a skewer ,"['sensory', 'metaphorical']",['violence_with_object'],False
has been pushed inside of me ,['unspecified'],['childbirth'],False
"and speared through my ovaries, uterus etc. ",['unspecified'],['violence_with_object'],False
being tattooed on the inside.,"['sensory', 'metaphorical']",['violence_with_object'],False
Some scratching my insides,"['sensory', 'metaphorical']",['violence_with_object'],False
a knife was piercing it.,['unspecified'],['violence_with_object'],False
being stabbed with safety scissors from the inside ,['unspecified'],['violence_with_object'],False
you just ran a marathon and need to lie down. ,"['sensory', 'metaphorical']",['physical_exertion'],False
Sometimes it feels like a hot poker ,['metaphorical'],['other'],False
or barbed wire is inside,"['sensory', 'metaphorical']",['violence_with_object'],False
a charly horse ,"['sensory', 'metaphorical']",['violence_with_object'],False
an elephant is sitting on my back or stomach,"['sensory', 'metaphorical']",['weight_pressure'],False
I'm pregnant. ,['unspecified'],['childbirth'],False
a wash cloth being rung out over and over again,"['sensory', 'metaphorical']",['violent_action'],False
a hot poker ,['unspecified'],['heat_temperature'],False
is being drilled through me. ,['unspecified'],['violence_with_object'],False
a sharp rod is being forced into my rectum. ,['sensory'],['other'],False
I'm being turned inside out. ,"['affective', 'metaphorical']",['transformative_state'],False
something inside will burst/rupture. ,['unspecified'],['weight_pressure'],False
my pelvic area is always heavy.,['unspecified'],['weight_pressure'],False
blisters  ,['unspecified'],['heat_temperature'],False
Braxton Hicks contractions,['unspecified'],['childbirth'],False
all over body pain when inflamed,['unspecified'],"['illness', 'generic_ache']",False
my lower back and stomach is trying to break free from the rest of my body,['unspecified'],['injury'],False
being stabbed with a rusty ice pick,['unspecified'],"['violence_with_object', 'heat_temperature']",False
my intestines were being tugged out of my anus when I had my period ,"['sensory', 'metaphorical']",['violent_action'],False
Freddy kugker playing hockey in my stomach. ,"['sensory', 'metaphorical']",['motion_forceful'],False
hockey in my stomach. ,"['sensory', 'metaphorical']",['motion_forceful'],False
I'm trying to give birth to my spine ,['unspecified'],['childbirth'],False
my insides are battling between themselves ,['unspecified'],['conflict'],False
using sharp tools. ,['sensory'],['other'],False
somebody is strangling my womb,"['sensory', 'metaphorical']",['violent_action'],False
"I become possessed by pain, like I am someone else that takes possession of my usual self",['metaphorical'],['generic_ache'],False
I am outside my body and my consciousness ,"['affective', 'metaphorical']",['transformative_state'],False
my uterus/bowel is being squeezed inside a Panini press. ,['unspecified'],['weight_pressure'],False
 And sometimes it feels like the panini press have spikes attached,['metaphorical'],['weight_pressure'],False
someone slowly stretching me apart some days,"['sensory', 'metaphorical']",['violent_action'],False
everything is dragging ,['unspecified'],['motion_forceful'],False
and going to fall out of me. ,"['sensory', 'metaphorical']",['motion_forceful'],False
my ovaries are at war with each other ,['unspecified'],['conflict'],False
Barbed wire and,"['sensory', 'metaphorical']",['violence_with_object'],False
a red hot poker up inside.,['unspecified'],['heat_temperature'],False
someone is smashing me with a hammer and glass,['unspecified'],['violent_action'],False
 and glass,"['sensory', 'metaphorical']",['violence_with_object'],False
someone is stabbing me in the vagina ,['unspecified'],['violence_with_object'],False
with a hot poker. ,['unspecified'],['heat_temperature'],False
a concrete block in my stomach weighing me down. ,"['sensory', 'metaphorical']",['weight_pressure'],False
I have  ball in blown up inside my stomach that's ready to burst ,['unspecified'],['weight_pressure'],False
balloon,['unspecified'],['weight_pressure'],False
 has gathered weight and is about to fall out through my bum.  ,['unspecified'],['weight_pressure'],False
It feels like a hot poker is sitting off them .,['metaphorical'],['other'],False
there's an iron bar put up through me. ,['unspecified'],['confinement'],False
a ball of pressure ,"['sensory', 'metaphorical']",['weight_pressure'],False
someone stabbing ,['unspecified'],['violence_with_object'],False
and cutting my stomach out and body up in 10 pieces.,['unspecified'],['violence_with_object'],False
seriously hot water dripping inside me ,['unspecified'],['heat_temperature'],False
 and burning,['sensory'],['heat_temperature'],False
your insides are ripped out and,['unspecified'],['violent_action'],False
 and turned around,"['sensory', 'metaphorical']",['motion_forceful'],False
someone poured petrol on me and set me on fire. ,['unspecified'],['heat_temperature'],False
Someone took a sharp kitchen knife and stabbed me repeatedly in the groin/pelvis. ,['sensory'],['violence_with_object'],False
Someone took a red hot poker ,['unspecified'],['heat_temperature'],False
and ripped open my section scar repeatedly.  ,['unspecified'],"['violent_action', 'injury']",False
something is eating me from the inside out.  ,"['sensory', 'metaphorical']",['attacking_agents'],False
A pain that radiates outwards ,['unspecified'],"['motion_forceful', 'generic_ache']",False
"makes me nauseated, dizzy and dissociated from my body.  ",['sensory'],['illness'],False
my organs are trying to birth themselves through various orrifices. ,['unspecified'],['childbirth'],False
someone took my insides and stepped on them threw them around rode a bike over them and then put back in my body. ,"['sensory', 'metaphorical']",['violence_with_object'],False
someone is stabbing me the whole time ,['unspecified'],['violence_with_object'],False
I'm being squeezed by a cobra or some big snake and can't move until it loosens up. ,['unspecified'],['violence_with_object'],False
a bruised feeling.,['unspecified'],['injury'],False
tiny blisters on the inside of my body that I would do anything to take out,['unspecified'],['heat_temperature'],False
something has ruptured,"['sensory', 'metaphorical']",['violent_action'],False
it has come back with a Vengeance to Derail me. ,"['affective', 'metaphorical']",['attacking_agents'],False
someone is grabbing my intestines and ,['unspecified'],['violence_with_object'],False
squeezing/,['unspecified'],['violence_with_object'],False
twisting them.  ,['unspecified'],['violent_action'],False
carpet burns all over my insides.  ,['sensory'],['heat_temperature'],False
"I have food poisoning, but I know it isn't, it is just morning with bowel endo.  ",['unspecified'],['illness'],False
your insides are going to fall out.,"['sensory', 'metaphorical']",['confinement'],False
there is a spikey ball rattling around heading off things. ,"['sensory', 'metaphorical']",['violence_with_object'],False
Like someone is pulling on my belly button from the inside.,['metaphorical'],['violent_action'],False
a dentist is picking at plaque ,"['sensory', 'metaphorical']",['violence_with_object'],False
there is a knife scraping at my insides.,['unspecified'],['violence_with_object'],False
a hot poker has been inserted inside of me and ,['unspecified'],['heat_temperature'],False
being waved all about and ,['unspecified'],['weather'],False
and stabbing areas at random.,['unspecified'],['violence_with_object'],False
"you have been hit by a car, ",['unspecified'],['violence_with_object'],False
 you're internally bruised but nothing to show of it.,['unspecified'],['injury'],False
When I have a bowel motion it feels like passing broken glass. ,['metaphorical'],['other'],False
When I have period pain it feels like someone is stabbing me in the pelvis with a knife.,['metaphorical'],"['violence_with_object', 'generic_ache']",False
someone has a knife and is stabbing me up my back passage. ,['unspecified'],['violence_with_object'],False
something is constantly tugging on my left ovary ,"['sensory', 'metaphorical']",['violent_action'],False
toothache but throughout my abdomen.,['unspecified'],['generic_ache'],False
Sometimes being kicked or ,"['sensory', 'metaphorical']",['violent_action'],False
 or something being forcefully jammed in the vagina.,"['sensory', 'metaphorical']",['violence_with_object'],False
having an awful bruise that is continually irritated and won't heal.,['unspecified'],['injury'],False
 At times the ache is sharper,['sensory'],['generic_ache'],False
something is clenching and ,['unspecified'],['violence_with_object'],False
and yanking my whole abdomen,"['sensory', 'metaphorical']",['violent_action'],False
It feels like there is a broken G as bottle ,['metaphorical'],['other'],False
 getting poked ,"['sensory', 'metaphorical']",['violent_action'],False
and scrapped around my pelvis.  ,"['sensory', 'metaphorical']",['violence_with_object'],False
Sharp metal grinding against itself,['sensory'],['other'],False
 cogs or machine parts. ,"['sensory', 'metaphorical']",['violence_with_object'],False
 Waves of,['unspecified'],['weather'],False
 pulsating pain.,['unspecified'],['generic_ache'],False
 Eruptions.,"['sensory', 'metaphorical']",['weight_pressure'],False
my inner organs are being flayed,"['sensory', 'metaphorical']",['violence_with_object'],False
like a sharp knife in inserted and twisted in my womb,"['sensory', 'metaphorical']","['violent_action', 'violence_with_object']",False
like a lightening,['metaphorical'],['other'],False
like a sudden deadly tearing and ripping,['metaphorical'],"['violent_action', 'injury']",False
